{
  "name": "worker_1",
  "generation": "0123456789abcdef0123456789abcdef",
  "image": "agent-pm-worker:aaaaaaaaaaaaaaaaaaaaaaaaaaaaaaaaaaaaaaaaaaaaaaaaaaaaaaaaaaaaaaaa",
  "cwd": "/Users/example/.kube",
  "claude_dir": "/Users/example/.agent-pm/docker-state/worker_1/claude",
  "hook_path": "/usr/local/bin/agent-pm-session",
  "labels": {
    "team": "crew"
  }
}
